Name,City,Neighborhood,Modality,Duration,Price,Booking URL,Notes,Source,Status
"Moonwood Massage & Sound Healing",Littleton,Littleton,"Massage therapy, reflexology, energy work, sound healing","Not published","Not published",http://www.moonwoodmassage.com/,"Massage is the primary practice; sound healing is secondary; Littleton is a Denver-metro suburb (~10mi south); 5.0 rating (9 reviews)","Google Maps + website","Active - secondary fit"
"A&A Sound Healing",Littleton,Littleton,"Sound healing","Not published","Not published",N/A,"Same building address as Moonwood Massage above (shared wellness suite); no website found, very thin data (1 review)","Google Maps","Active - thin data"
"Infinite Sound Healing",Denver,Unknown,"Sound healing","Not published","Not published",N/A,"No website or address found beyond coordinates; phone contact only","Google Maps","Active - thin data"
"Soul Growth Network",Denver,Unknown,"Sound bath (Sunday recurring)","Not published","Not published","https://www.eventbrite.com/e/sunday-morning-sound-bath-tickets-1117045726839","'Sunday Morning Sound Bath' at 1545 S Pearl St, Denver","Eventbrite (Tavily search)",Active
"Yoga of the Mind",Denver,"Baker / Wash Park / South Broadway","Sound bath for stress relief + energy clearing","Not published","Starts at $16.50","https://www.eventbrite.com/e/sound-bath-for-stress-relief-energy-clearing-baker-washpark-denver-tickets-1989215553268","Recurring Saturdays 10am; confirmed pricing, on South Broadway","Eventbrite (Tavily search)",Active
"Black Raven Wellness (Taylor)",Denver,"Park Hill","Sound bath (seasonal/themed events)","Not published","Not published","https://www.eventbrite.com/e/new-years-sound-bath-tickets-1977394406901","Recurring seasonal series at Dandy Lion Coffee Co. (New Year's Sound Bath, Summer Solstice Sound Bath both seen there) - coffee shop venue partnership","Eventbrite (Tavily search)",Active
"Liminal Lemonade",Denver,Unknown,"Sound bath (seasonal events)","Not published","Not published","https://www.eventbrite.com/e/golden-hour-a-summer-solstice-sound-bath-tickets-1989345850992","'Golden Hour: A Summer Solstice Sound Bath' at a venue called Harmonist Sanctuary - worth checking if that venue hosts its own regular programming","Eventbrite (Tavily search)",Active
"Aion Wellness",Denver,Unknown,"Sound bath meditation (seasonal/themed events)","Not published","Not published","https://www.eventbrite.com/e/samhain-soundbath-meditation-soul-spirit-tickets-1829724036849","'Samhain Soundbath Meditation: Soul & Spirit' at a venue called Sakala; this specific Oct 2025 date has passed but organizer appears active","Eventbrite (Tavily search)","Active - check for current dates"
